{
  "schema_version": "plectarium.family-source-lock.v1",
  "publication_status": "pending",
  "family_id": "standalone-capability-family",
  "repository": "https://github.com/cooperonlineenterprises/plectarium-family.git",
  "git_commit": null,
  "packet_path": "standalone-capability-family-packet-v1",
  "packet_version": "1.2.0",
  "packet_manifest_sha256": null,
  "packet_checksums_sha256": null,
  "contracts": [
    {"path": "spec/family-identity-and-repository-map.md", "sha256": null, "status": "ACCEPTED"},
    {"path": "spec/schemas/standalone-capability-manifest.v0.schema.json", "sha256": null, "status": "PROVISIONAL"},
    {"path": "spec/schemas/result-envelope.v0.schema.json", "sha256": null, "status": "PROVISIONAL"},
    {"path": "spec/schemas/result-reference.v0.schema.json", "sha256": null, "status": "PROVISIONAL"},
    {"path": "spec/schemas/permission-set.v0.schema.json", "sha256": null, "status": "PROVISIONAL"}
  ],
  "limitations": ["publication pending"]
}
